{
  "schemaVersion": 1,
  "id": "ux",
  "name": "UX and visual design baseline",
  "owner": "ux-governance-team",
  "version": "1.0.0",
  "appliesTo": {
    "workflows": ["poc", "implementation", "pdlc"],
    "stages": ["requirements-clarification", "acceptance-criteria-definition", "principle-applicability", "ux-design", "test-strategy", "build-readiness", "implementation", "developer-verification", "test-execution", "acceptance-verification"],
    "technologies": ["web-ui", "mobile-ui"]
  },
  "enforcement": {
    "poc": "required",
    "implementation": "required",
    "pdlc": "required"
  },
  "principles": [
    {
      "id": "ux-blue-foundation",
      "title": "Use the approved blue visual foundation",
      "requirement": "Use #0B5FFF as the primary action color, #E8F1FF as the light surface, #073B9A as the dark interaction state, and neutral backgrounds; define them as reusable design tokens rather than scattered literals.",
      "standardDefault": {
        "key": "ux.visual-foundation",
        "topic": "uxInteraction",
        "policy": "constraint"
      }
    },
    {
      "id": "ux-semantic-color",
      "title": "Do not communicate state by color alone",
      "requirement": "Pair color with text, iconography, shape, or another visible cue for status, validation, selection, and destructive actions.",
      "standardDefault": {
        "key": "ux.semantic-color",
        "topic": "uxInteraction",
        "policy": "constraint"
      }
    },
    {
      "id": "ux-accessible-interaction",
      "title": "Keep interactive experiences accessible",
      "requirement": "Use semantic controls, visible keyboard focus, programmatic labels, sufficient color contrast, and reduced-motion support where motion is present.",
      "standardDefault": {
        "key": "ux.accessible-interaction",
        "topic": "qualityAttributes",
        "policy": "constraint"
      }
    },
    {
      "id": "ux-responsive-baseline",
      "title": "Support desktop and mobile layouts",
      "requirement": "Define behavior for at least one mobile width and one desktop width, prevent horizontal overflow, and keep primary actions usable without hover.",
      "standardDefault": {
        "key": "ux.responsive-baseline",
        "topic": "uxInteraction",
        "policy": "constraint"
      }
    },
    {
      "id": "ux-complete-states",
      "title": "Design complete interaction states",
      "requirement": "Specify and implement relevant empty, loading, success, error, disabled, focus, and destructive-action states for the POC scope.",
      "standardDefault": {
        "key": "ux.complete-states",
        "topic": "uxInteraction",
        "policy": "constraint"
      }
    }
  ]
}
